{
  "schema_version": 1,
  "id": "WI-025-governed-run-proof-point-and-evidence",
  "state": "queued",
  "queued_at": "2026-06-29T00:00:00Z",
  "attempts": 0,
  "max_attempts": 3,
  "touches_protected_path": true,
  "allowed_edit_set": [
    ".github/workflows/modonome-auto.yml",
    "scripts/agent/",
    "prompts/roles/",
    "examples/demo-app/",
    "README.md",
    "docs/ops/runner-model-config.md",
    "docs/public-claims.json",
    "tests/",
    "site/index.html",
    "site/repo-data.js",
    "RELEASE-EVIDENCE.md"
  ],
  "gates": [
    "node scripts/check-self-application.mjs",
    "node scripts/check-repo-hygiene.mjs",
    "npm run verify",
    "node scripts/check-style.mjs ."
  ]
}
