{
  "schema_version": 1,
  "id": "WI-039-prompt-behavioral-regression",
  "state": "queued",
  "attempts": 0,
  "max_attempts": 3,
  "touches_protected_path": true,
  "allowed_edit_set": [
    "scripts/test-prompt-behavior.mjs",
    "tests/fixtures/prompt-behavior/",
    ".github/workflows/ci.yml",
    "scripts/check-self-application.mjs"
  ],
  "gates": [
    "node scripts/test-prompt-behavior.mjs",
    "node scripts/check-style.mjs .",
    "npm run verify"
  ],
  "queued_at": "2026-07-01"
}
