{
  "schema_version": 1,
  "id": "WI-029-runner-single-shot-patch-mode",
  "state": "queued",
  "attempts": 0,
  "max_attempts": 3,
  "touches_protected_path": true,
  "allowed_edit_set": [
    "scripts/agent/run-cycle.mjs",
    "scripts/agent/apply-patch.mjs",
    "tests/run-cycle-openai.test.mjs"
  ],
  "gates": [
    "node --test tests/run-cycle-openai.test.mjs",
    "node scripts/check-style.mjs .",
    "npm run verify"
  ],
  "queued_at": "2026-07-01"
}
