{
  "schema_version": 1,
  "id": "WI-012-create-mcp-server-docs",
  "state": "queued",
  "attempts": 0,
  "max_attempts": 3,
  "touches_protected_path": false,
  "allowed_edit_set": [
    "docs/mcp-server.md",
    "README.md",
    "QUICKSTART.md",
    "ADOPTION-GUIDE.md"
  ],
  "gates": [
    "node scripts/check-style.mjs ."
  ]
}
