{
  "schema_version": 1,
  "id": "wave-2-agent-harness-and-capture",
  "state": "checking",
  "touches_protected_path": true,
  "escalation_reason": "Approved plan to make autonomy real. Wave 2 bundles WS-B (the on-demand maker-checker harness scripts/agent/run-cycle.mjs with role prompts shared between the harness and the CI workflow) and WS-C (real captured maker-checker artifacts on the demo app). The owner approved the plan; protected paths scripts/, .github/, and prompts/ are in scope.",
  "maker_id": "maker:wave-2:claude-opus-4-8",
  "maker_model": "claude-opus-4-8",
  "allowed_edit_set": [
    "scripts/",
    ".github/",
    "prompts/",
    "package.json",
    "examples/",
    "tests/",
    "RELEASE-EVIDENCE.md"
  ],
  "gates": ["verify", "ratchet"]
}
